Ihsan+Septiadi_20170823_mui,"Ihsan__20170823,Septiadi__20170823",Fiel_Sahir_20170609,8/23/2017,Screen Shot 2017-11-05 at 5.14.16 PM.png (https://dl.airtable.com/8GRKxqyRm6NalJYjQEVg_Screen%20Shot%202017-11-05%20at%205.14.16%20PM.png),Ihsan+Septiadi_20170823_mui.png (https://dl.airtable.com/nzJw7UQXROSOoV4RHxvd_Ihsan%2BSeptiadi_20170823_mui.png),mui,,Musi,Palembangnese,,,Indonesia,11/29/2017,Public,CC BY-SA 4.0,checked,,,,"Polyglot Indonesia Jakarta Meetup.

Possible addition to bio at the bottom, all tentative that we can add/edit with time. 

Polyglot Indonesia is a collective of language enthusiasts from around the archipelago coming together to celebrate diversity.",,1 checked out of 1,,,,,,1,,,No ID,"3,105,000 (2000 census).","Austronesian, Malayo-Polynesian, Malayo-Chamic, Malayic, Malay",,,"This video was recorded by Fiel Sahir in Yogyakarta, Indonesia, where he met Ihsan and Septiadi at a Polyglot Indonesia Jakarta meetup event. Musi, also known as Palembangese, is spoken by more than three million people, primarily in the Indonesian province of South Sumatra. It is a member of the Malayan family of languages, and is therefore also known as ‘Palembang Malay’ for the city of Palembang, the capital of South Sumatra. It is also called Basa Pelembang Sari-sari and Sekayu. Having emerged in the 18th century CE as the language of Javanese settlers in Sumatra, Musi shares vocabulary with Javanese. In recent decades, it has emerged as a lingua franca for much of South Sumatra, which, like other Indonesian provinces is linguistically diverse.",Eurasia,,2017-9-2,Jakarta Special Capital Region_ID,
Ayu_20170823_jav,Ayu_Assyamsi_20170823,Fiel_Sahir_20170609,8/23/2017,Screen Shot 2017-12-07 at 6.50.11 PM.png (https://dl.airtable.com/JUb8ElVWRU68LzrznAZZ_Screen%20Shot%202017-12-07%20at%206.50.11%20PM.png),Ayu_20170823_jav.jpg (https://dl.airtable.com/qFrRSxZtTCuDOfz3O5gH_Ayu_20170823_jav.jpg),jav,,Javanese,Javanese (Multiple Variaties) ,,,Indonesia,12/24/2017,Public,CC BY-NC 3.0,,,,,"Polyglot Indonesia National Gathering Yogyakarta 2017 

""Ayu said she's more than happy to transcribe and if not we can find people who will do it. Slight problem is that dialects are often considered not ""proper"" for writing with the native script so it may or may not be hard. REMIND ME!! """,,1 checked out of 1,,,,,,1,,gs3rmilVQLM,https://youtu.be/gs3rmilVQLM,"84,300,000 in Indonesia (2000 census). 25,000 in south Sulawesi, and 69,000,000 on Java, 500,000 of them being in Banten region and 2,500,000 in Cirebon region of Java. Population total all countries: 84,308,740.","Austronesian, Malayo-Polynesian, Javanese",,,"This video was recorded by Fiel Sahir in Yogyakarta, Indonesia, where he and Rama met at a Polyglot Indonesia Jakarta meetup event. Javanese is spoken by more than 80 million people, principally on the island of Java in Indonesia, and by diaspora communities worldwide. A literary language since at least the fifth century CE, Javanese has been written using three writing systems: the Latin and Arabic alphabets, as well as a native Javanese script of Indian and Aramaic influence. The language emerged in its modern written form with the rise of the Mataram Sultanate in the 16th century CE, and is among Wikipedia's 100 most-used languages today. An Austronesian language, Javanese is most closely related to Malay, Sundanese and Balinese, and more distantly so to Chamorro and Kiribatese.",Eurasia,,2017-9-2,Jakarta Special Capital Region_ID,
Sita_20151201_mqy,Sita__20151201,Athina_Ardhyanto_,12/1/2015,mqy-thumb-raw.png (https://dl.airtable.com/WqeMAvt6SFKzQzPEEj1a_mqy-thumb-raw.png),Sita_s1_F_20151201_mqy.jpg (https://dl.airtable.com/8Kjog2SFRmy1ZULqXqeq_Sita_s1_F_20151201_mqy.jpg),mqy,,Manggarai,Wae Rebo Manggarai,,,Indonesia,2/16/2016,Public,Standard,,,,,,,1 checked out of 1,,10,,,,1,checked,fZmLy_Acth8,https://youtu.be/fZmLy_Acth8,900000,"Austronesian, Malayo-Polynesian, Central-Eastern Malayo-Polynesian, Bima-Lembata",Austronesian,§Wae Rebo Manggarai,,Eurasia,,2015-12-1,,
Argo_20150418_ind,Argo_Cayhadi_20150418,Argo_Cayhadi_20150418,4/18/2015,argo.png (https://dl.airtable.com/VlZysNoSRqZWtFhPqPwI_argo.png),Argo_s1_M_20150418_ind.jpg (https://dl.airtable.com/xfepF0vcTUKFA6tMUoU0_Argo_s1_M_20150418_ind.jpg),ind,,Indonesian,,,,Indonesia,4/18/2015,Public,CC BY-NC 3.0,,checked,"Halo semua, apa kabar? Saya Argo, Saya dari Indonesia, saya disini berbicara dalam Bahasa Indonesia yang dipakai kurang lebih 90% (sembilan puluh persen) dari seluruh penduduk Indonesia yang kurang lebih berjumlah 240.000.000 (dua ratus empat puluh juta) orang, atau kurang lebih penuturnya sekitar 200.000.000 (dua ratus juta) orang, dan juga dipakai oleh 5.000.000 (lima juta) orang Indonesia yang tinggal di luar negeri. Bahasa ini disepakati ketika Sumpah Pemuda tahun 1928 (seribu sembilan ratus dua puluh delapan) yang ketika itu disepakati sebagai bahasa nasional (dan) bahasa persatuan karena Indonesia terdiri dari berbagai macam kultur dan etnik, menggantikan bahasa melayu yang ketika itu dipakai sebagai bahasa administrasi atau perdagangan oleh pemerintah Belanda. Hal ini kemudian diperkuat ketika Indonesia merdeka 17 (tujuh belas) Agustus 1945 (seribu sembilan ratus empat puluh lima), dibentuklah Undang-Undang Dasar yang ketika itu menyepakati bahwa Indonesia memiliki identitas diantaranya adalah Bendera Merah Putih, Bahasa Indonesia, Lagu Kebangsaan Indonesia Raya, dan juga Lambang Negara Garuda Pancasila, serta Semboyan Negara Bhineka Tunggal Ika. Untuk yang belum mengetahui tentang Indonesia sendiri, Indonesia adalah negara kepulauan, terdiri dari (kurang lebih) 17.000 pulau, membentang dari Aceh hingga (pulau) Papua (bagian) Barat. Mungkin kalau masyarakat di seluruh dunia lebih mengenal Bali daripada Indonesia sendiri, karena Bali merupakan salah satu tempat pariwisata. Bali merupakan salah satu dari 34 Provinsi yang ada di Indonesia. Karena kami terdiri dari berbagai macam etnik, kita selalu berpegang pada semboyan negara kami, yaitu Bhineka Tunggal Ika yang artinya berbeda-beda tetapi tetap satu. Perkembangan tata bahasa dan linguistik, terutama di bahasa Indonesia, sejak masa kolonial sangat berkembang sekali, terutama karena lima tahun sekali para ahli-ahli bahasa di Indonesia menyelenggarakan kongres Bahasa Indonesia, yang di situ menghasilkan beberapa kesepakatan penting, seperti pada tahun 1972 (seribu sembilan ratus tujuh puluh dua) itu disepakati tentang ejaan (baku), terutama ejaan yang kita pakai hari ini, yaitu Ejaan Yang Disempurnakan, kemudian tahun 1988 (seribu Sembilan ratus delapan puluh delapan), dibentuklah Kamus Besar Bahasa Indonesia. Selain Bahasa Indonesia sendiri sebetulnya seluruh Warga Negara Indonesia hampir bisa dibilang mayoritas juga berbicara dalam bahasa etniknya masing-masing yang berjumlah lebih dari 700 (tujuh ratus) bahasa. Seperti yang telah saya sebutkan tadi, Bahasa Melayu yang dulu sempat dipakai ketika pemerintah kolonial Belanda, saat ini juga tetap masih dipakai terutama di bagian pesisir timur (pulau) Sumatera, kemudian di pesisir barat (pulau) Kalimantan, serta di Negara tetangga seperti Malaysia, Singapura, dan Brunei Darussalam. Karena saya sendiri, orang tua saya dari suku Jawa, maka saya juga bisa berbicara dalam Bahasa Jawa, dimana Bahasa Jawa sendiri dipakai kurang lebih 40% (empat puluh persen) oleh penduduk Indonesia (atau) kurang lebih 80.000.000 (delapan puluh juta) orang. Kemudian bahasa Sunda, juga karena saya tinggal di Bandung, Bahasa Sunda adalah bahasa etnik yang dipakai di sini oleh suku Sunda, kurang lebih dituturkan oleh hampir 38.000.000 (tiga puluh delapan juta) orang. Bahasa Indonesia sendiri sebetulnya terbentuk dari berbagai macam kosakata (bahasa) yang ada di seluruh dunia, terutama Portugis, Belanda, China, Arab, Melayu, Bahasa Inggris, dan juga dari Sanskrit atau Sansekerta. Kemudian juga banyak sekali kosa kata dari bahasa daerah yang pada akhirnya dipakai dalam bahasa Indonesia. Mungkin kata-kata dari Bahasa Portugis yang saya tahu diantaranya adalah Gereja, Bangku, Dansa, Garpu, Lemari, Roda, dan juga Sepatu. Kemudian di dalam Bahasa Belanda, banyak sekali kosakata bahasa belanda yang kita pakai juga, yang sampai hari ini pun masih kita sering dengar sehari-hari diantaranya Abonemen, Persneling, Verboden, Karcis, Indekost, Prasmanan, Kulkas, dan lain-lain. Sebetulnya seperti berbagai macam bahasa di dunia, kita juga punya tata bahasa resmi dan juga untuk sehari-hari kita berbicara dalam bahasa yang tidak resmi bahkan tidak jarang pakai bahasa “slang” atau bahasa pergaulan. Dan bahasa pergaulan sendiri pun berbeda-beda antar kota, misalnya kalau di kota-kota besar seperti Jakarta, Bandung, Semarang, Surabaya, Medan, Palembang, Makassar, Jogja, itu semua masing-masing dipengaruhi oleh dialek etniknya masing-masing. Jadi kadang-kadang bahasa slang atau bahasa pergaulan yang kita temui di Jakarta belum tentu dimengerti oleh teman-teman yang ada di Bandung dan sebagainya. Di tingkat Internasional bahasa Indonesia dipakai di kurang lebih 45 (empat puluh lima) Negara di dunia, terutama oleh orang-orang Indonesia yang tinggal di luar negeri, kemudian menurut beberapa sumber, mulai banyak dipelajari di Australia dan juga Vietnam, kemudian pemerintah Indonesia kabarnya (akan) mengusahakan bahasa Indonesia menjadi salah satu bahasa Internasional di Perserikatan Bangsa-Bangsa dengan mempertimbangkan kemapanan bahasa, jumlah penuturnya yang mungkin lebih dari 300.000.000 (tiga ratus juta) orang, dan juga kepopulerannya di tingkat Internasional. Jadi apakah kalian tertarik untuk belajar Bahasa Indonesia?","Hello all, how are you? I’m Argo, I’m from Indonesia. Here I am speaking in Indonesian which used by approximately 90% from all of 240,000,000 Indonesian residents, or approximately spoken by 200,000,000 persons, and also used by 5,000,000 Indonesians living abroad. This language was agreed on the youth pledge congress in 1928, when it is agreed as the national language and the language of unity because Indonesia consists of various tribes and ethnics, replacing Malay language as it used as the language of administration and trade by Dutch government. This was later confirmed when Indonesia became independent on August 17th, 1945, then formed the Constitution which was agreed that Indonesia has the identity: the Red and White Flag, Indonesian Language, Anthem Indonesia Raya, and also the State emblem of Garuda Pancasila, as well as the state motto of Bhineka Tunggal Ika. For who do not know about Indonesia, Indonesia is an archipelago, consisting of (approximately) 17,000 islands, stretching from Aceh to (Western island of) Papua. Perhaps if people around the world know more about Bali than Indonesia itself, because Bali is one of the tourist places. Bali is one of the 34 province in Indonesia. Because we consist of various ethnic, we have always adhered to the motto of our country, Bhineka Tunggal Ika, which means unity in diversity. The development of grammar and linguistics is highly evolved since the colonial period, especially on Indonesian language congress that involved Indonesian language expertise every five years, in which resulted in several important agreements, such as in 1972 was agreed on (formal) spelling, especially spelling we use today, called Ejaan Yang Disempurnakan (Enhanced Spelling), then in 1988 they formed Indonesian Big Dictionary. Besides Indonesian, the majority of Indonesian citizen also could speak their own ethnic language, which accounted for more than 700 language. As I mentioned earlier, Malay who once had worn when the Dutch colonial government, today is still used especially in the east coast (island of) Sumatra, also on the west coast (island of) Kalimantan/Borneo, as well as in neighboring countries such as Malaysia, Singapore and Brunei Darussalam. Because of my own, my parents from the Javanese, then I can also speak in Javanese, where the Java language itself used approximately 40% of the population of Indonesia (or) approximately 80,000,000 people. Then Sundanese, also because I live in Bandung, Sundanese are ethnic languages spoken here, which is spoken by nearly 38 million people. Indonesian itself is actually made up of a wide range of vocabulary (language) that exist throughout the world, especially the Portuguese, Dutch, Chinese, Arabic, Malay, English, and also from the Sanskrit. Then also a lot of the vocabulary of the ethnical language that ultimately used in Indonesian. Perhaps the words of Portuguese that I know of which is the Igreja (Church), Banco (Bench), Dança (Dancing), Garfo (fork), Armário (Wardrobe), Roda (Wheel), and also Sapatos (Shoes). Later on in Dutch, a lot of vocabulary that we use the Dutch language as well, which to this day still we often hear them everyday such as Abonnement (Subscription), Versnellings (Gearboxes), Verboden (Forbidden), Kaartje (Tickets), Indekost (Boarding House), Fransman (Buffet), Koelkazt (Refrigerator), and many others. Actually, like many languages in the world, we also have a formal grammar and also informal form for everyday speaking. We also used ""slang"" language or lingua franca. And lingua franca itself also vary between cities, for example if in big cities such as Jakarta, Bandung, Semarang, Surabaya, Medan, Palembang, Makassar, Yogyakarta, it all each influenced by ethnic dialects respectively. Sometimes slang language or lingua franca that we encountered in Jakarta is not necessarily understood by friends in Bandung and so on. In International level, Indonesian used in approximately 45 countries in the world, mainly by the Indonesian people who live abroad, and according to some sources, ranging widely studied in Australia and also Vietnam. Then the Indonesian government reportedly (will) seek Indonesian become one of the international language in the United Nations, considering the reliability of the language, the number of speakers who may be more than 300,000,000 people, and also its popularity at international level. So, are you interested to learn Indonesian?",,Get a free Indonesian lesson with italki: http://promos.italki.com/wikitongues_ind,1 checked out of 1,checked,,Facebook,2016-5-31,https://www.facebook.com/wikitongues/videos/1122690891128770/,1,checked,M5alRFKK43Y,https://youtu.be/M5alRFKK43Y,"22,800,000 in Indonesia (2000), increasing. Population total all countries: 23,200,480. L2 users: 140,000,000 in Indonesia.","Austronesian, Malayo-Polynesian, Malayo-Chamic, Malayic, Malay",Austronesian,"Indonesian,,,,,",,Eurasia,,2015-4-18,,
Julius_20151020_bbc,Julius__20151020,Argo_Cayhadi_20150418,10/20/2015,julius-bbc-thumb.png (https://dl.airtable.com/T68WVwWPTPyQwDNrhcPA_julius-bbc-thumb.png),julius-bbc-thumb.jpg (https://dl.airtable.com/xILtc7hyRzuCH7V8em1r_julius-bbc-thumb.jpg),bbc,,Batak Toba,,,,Indonesia,10/20/2015,Public,CC BY-NC 3.0,,checked,"Horas! Goarku Julius Siregar, ahu sian Medan, Jala di si ma ahu tubu, di Medan i. Ahu halak Batak, jadi na hu pakkeon ima hata Batak, Batak toba lebih tepatna, ala di Batak adong tujuh sub-etnik: Batak Toba, Batak Karo, Simalungun, dohot na lainna. Jadi, anggo na hu dokkon sinangkina ni: Horas, ima sebenarna hata sapaan na dipakke anggo pajumpang tu halak na asing manang naeng manjou halak. ima nanidokna Horas. Ahu tubu di Medan, ale intor pinda muse tu huta ima di Samosir, jala di si ma ahu balga. Di sima ahu dohot bapakku dohot omakku tinggal sahat muse anon balek tu Medan. Jadi ahu marga Siregar, bapakku pe marga Siregar. Ala di halak Batak, marga ibuat sian garis bapa dang garis omak. Jala omakku marga Sinaga, ale anggo di halak Batak marga di borua dang di dokkon marga Sinaga ale boru Sinaga. Jadi Bapakku marga Siregar dohot omakku boru Sinaga. Anggo di hami sakaluarga adong tolu itoku jala sada abangku manang hahaku. Jadi lima ma hami sude. Anggo di halak batak adong ma na di dokkon Tarombo. Tarombo ima partuturan ni halak batak tu halak na asing. Jadi molo pajumpang tu halak di halak Batak an apalagi di huta an, molo pajumpang dang goarna parjolo di dokkon. molo marsitandaan tu halak na parjolo di dokkon ima margana. marga aha au? marga aha i mana? Dung isi ma hami boi marsitandaan, jala di si ma hami boi martutur, diboto hami tarombo nami masing-masing. Jala diboto hami ma manjou aha tu dongan nami. Misalna pajumpang tu marga Siregar, hu dokkon annon Appara. Pajumpang tu marga Nainggolan hu dokkon annon Appara. Molo pajumpang ahu tu marga Sinaga, ala omakku Sinaga intor hu boto ma manjou aha, manjou Tulang, ala manjou Opung. Songon i ma partuturan manang panjouion di halak Batakan. Dungi, asing ni i adong muse na didokkon Amangboru, Bapatua, Tulang. I, ro ma i sian partuturon-partuturon sinangkinani sian partuturan ni marga jala tu partuturon ni keluarga. Molo adong nangkin keluarga baoa sian omakku, intor hu jou ma i tulang. Na dialap ni Tulang, ima na hu jou Nantulang. Molo adong muse keluarga baoa sian bapa ima na hu jou Bapatua manang Bapauda. Bapatua ima haha ni bapaku, Bapauda ima anggini bapaku. Ale anggo ito ni bapaku, ima na hu jou Namboru jala na mangalap Namboru ima Amangboru. Songoni ma jo hira-hira partuturani halak Batak. Muse, molo di halak Batak adong sada adat na porlu taboto ima na didotna Dalihan Na Tolu. Dalihan Na Tolu ma adat na paling timbo di halak Batak. ima nanidok: Somba mar Hula-hula, elek marboru manang / jala manat mardongan tubu. Somba marhula-hula ima lapatanna: Ikkon ta somba, ta hormati jala ikkon ta burju-burjui ma tu hula-hula ta, ala sian i ma annon ro pariban ta sude. Hula-hula i ma sude pinompar ni sian oma, sian pihak boru-boru, sian inong ta. Ima na tadokna tulang. adong ma di si Tulang Rorobot, adong ma di si Tulang Mataniari, ima sude halak ima hula-hula. Dungi, adong na didokna elek marboru jala adong sada nai manat mardongan tubu. Ima anggo di adat ni halak Batak diparpestaan manang di hangoluan ni halak Batak di sadari manang di hangoluan ni siapari. Di halak Batak, adong muse na didokni pelengkap adat di si ma adong tarian, di si ma adong musik. Tarian anggo di halak Batak ima na nidokni Tortor. Anggo didokkon Manortor, ima tarian na adong di halak Batak an na dipakke biasana di pesta, manang hamatean, adong hatutubuon, manang adong na mangoli manang di sude pesta pasti adong na didokna manortor. Ala i do salasada identitas ni halak Batak, Manortor. di si ma adong sude upacara, di si ma adong paruning-uningan. Paruning-uningan i ma anggo na ta boto di basa modern Musik, Uning-uningan ma didokkon di halak Batak an. Adong uningan-uningan bolon, adong uningan gondang hasapi. I ma sude na adong di halak Batak an. Jadi songon i ma jo na boi hu patupa na boi hu dokkon, na boi hu patorangkon jala na hu pakke di hata Batak on. Mauliate. Horas!","Horas, my name Julius Siregar, I am from Medan (North Sumatera - Indonesia), And there is (also) where i was born, in Medan. I am Batak people, so, what I am using (to speak) now is Batak language, precisely Batak Toba. Because there are seven sub-ethnic of Batak: Batak Toba, Batak Karo, Simalungun, with the others. So what I have mentioned earlier: Horas, that's actually the word used for greeting when meet with other people, or when calling people. That's Horas. I was born in Medan, then immediately moved to the village, in Samosir (North Sumatera - Indonesia), and I grew up there. There is where I lived along with my father and my mother, then later we back again to Medan. So, I am Siregar clan, my father was Siregar clan. Because in Batak culture, clan lineages taken from father, not from mother. My mother clan is Sinaga, but in Batak, clan for (married) women are not referred as Sinaga, but (we called) Boru Sinaga. So for my father's clan title is Siregar, and my mother is Boru Sinaga. In my family, I have three older sisters, and one brother. we are five brothers. In Batak people, there's something called ""Tarombo"". ""Tarombo"" is about how we (Batak people) speaks to the others (based on clan tree or Genealogy). So, when Batak people meet each other especially in villages, we did not introduce the name on the encounter. When we introduced ourselves, the first to be said is clan. What clan I was? and what his/her clan? after that we can know each other. And there we were able to speak and adjust based on ""Tarombo"" respectively. So that we know what we should call to each other. For example, when meeting with Siregar clan, I'll call him ""Appara"". Met with Nainggolan clan (still close clan relation on genealogy), I also call ""Appara"". If met with Sinaga clan, because my mother also Sinaga, I immediately know what to call, that should call ""Tulang"" or ""Opung"". That's how to speak or how to determine the call in Batak peoples. In addition to that, there is also a call like ""Amangboru"", ""Bapatua"", ""Tulang"". All calls had come from the lineage clan linked to the family lineage. if there is a family man from the mother, I have to call him ""Tulang"", and ""Nantulang"" is Tulang's wife. If there is also a family man from the father, who should I call it with ""Bapatua"" or ""Bapauda"". Bapatua is the elder brother of the father, while Bapauda is the younger brother of the father. But for all the sister from the father, I called her ""Namboru"", and her husband I called ""Amangboru"". That's more or less how to speak in the Batak. Then there is a traditional Batak custom we need to know, which is called ""Dalihan na Tolu"" (three feet firebox). It is the highest custom of Batak people, which consists of: ""Somba mar Hula-hula"", ""Elek marabou"", and ""Manat Mardongan Tubu"". Somba Mar Hula-hula means we must raise, respect, and must be nice to Hula-Hula, because of the Hula-hula was all Pariban (future wife) would come. Hula-hula is all male relatives of the mother. They are the ones that we call ""Tulang"" (Uncle). There is a term ""Tulang Rorobot"" (Uncle from wife, Uncle from Uncle's wife from Mother relations), and also the term ""Tulang Mataniari"" (Uncle from far relatives from mothers). All that known as ""Hula-hula"". Then there are a term ""Elek Marboru"" (persuade/ask nicely with a sister/female relatives), and another one ""Manat Mardongan Tubu"" (live in harmony with a related friends or friends with same clan). That is the customary in Batak people both in the celebration/party also in everyday life. For Batak people, there is also something that complete our customary: the dance and music. dances of Batak people called ""Tortor"". If we said ""Menortor"", that means dancing which Batak people are usually used at the celebration/party, either party of death, birth or wedding, or at all existing celebration/parties. because that's one of the identity of the Batak people, namely Manortor. In ceremony and party there is something we called Paruning-uningan. Paruning-uningan in modern language we know as music. There are Uning-uningan Bolon (big/complete ensemble music), and also Uningan Gondang Hasapi (set of musical instruments without percussion). That's all ours life as Batak people. So that is what i can tell, inform, and explained, and everything I speak in Batak language. Thank you. Horas!","Poor audio quality

",,1 checked out of 1,,,,2016-8-4,,1,checked,SSOxL2VRIeE,https://youtu.be/SSOxL2VRIeE,"2,000,000 (1991 UBS).","Austronesian, Malayo-Polynesian, Northwest Sumatra-Barrier Islands, Batak, Southern",Austronesian,"Batak Toba,,,,,",,Eurasia,,2015-4-20,,
