IDv2,Speakers,Source,Date added,Raw Thumbnail,Branded Thumbnail,Languages by ISO Code,Captions by ISO Code,Languages Used,Alternate Name,Speaker Notes,Intake notes,Video Nation,Youtube Publish Schedule,Public (Youtube),Licenses,Publicity Clause,Transcribed,Transcription,Translation,Notes,italki call to action,italki active language,italki video has link,Publish order,Secondary Publish,Published on (Facebook),Facebook URL,Languages per video,Youtube Banners Updated,Youtube ID,Youtube URL,Demographics,Geneaology,Top level genealogy per language,Given language name,Video Description,Continent,.IDv1,Record Created At,Video Territory,Caption File Link
Dr.KarelOliva_20160330_ces+eng+bul+ita+deu+rus,Dr.KarelOliva__20160330,Vojta_Smekal_,3/30/2016,Dr.KarelOliva_20160330_ces+eng+bul+ita+deu+rus.png (https://dl.airtable.com/0BtJh7VrQgaqE7dUVaPC_Dr.KarelOliva_20160330_ces%2Beng%2Bbul%2Bita%2Bdeu%2Brus.png),Dr.KarelOliva_20160330_ces+eng+bul+ita+deu+rus.jpg (https://dl.airtable.com/Z1x2vYPtRlu2F0NK7sK3_Dr.KarelOliva_20160330_ces%2Beng%2Bbul%2Bita%2Bdeu%2Brus.jpg),"ces,eng,bul,ita,deu,rus",,"Czech, English, Bulgarian, Italian, German, Standard, Russian",,,,,9/14/2017,Public,Standard,,,,,,"Get a free Czech lesson with italki: http://promos.italki.com/wikitongues_ces, Get a free English lesson with italki: http://promos.italki.com/wikitongues_eng, Get a free Bulgarian lesson with italki: http://promos.italki.com/wikitongues_bul, Get a free Italian lesson with italki: http://promos.italki.com/wikitongues_ita, Get a free German, Standard lesson with italki: http://promos.italki.com/wikitongues_deu, Get a free Russian lesson with italki: http://promos.italki.com/wikitongues_rus",6 checked out of 6,,99,,,,6,,CwGK0BmHbmY,https://youtu.be/CwGK0BmHbmY,"10,400,000 in Czech Republic (ELDIA 2012). Population total all countries: 10,619,340., 55,600,000 in United Kingdom (ELDIA 2012). Population total all countries: 335,148,868. L2 users: 1,500,000 in United Kingdom (Crystal 2003). L2 users worldwide: 505,000,000., 7,020,000 in Bulgaria (ELDIA 2012). Population total all countries: 8,157,770., 57,700,000 in Italy (ELDIA 2012). Population total all countries: 63,655,047., 69,800,000 in Germany (ELDIA 2012). Population total all countries: 78,245,280. L2 users: 8,000,000 in Germany (ELDIA 2012)., 137,000,000 in Russian Federation (2010 census). Population total all countries: 167,332,230.","Indo-European, Slavic, West, Czech-Slovak, Indo-European, Germanic, West, English, Indo-European, Slavic, South, Eastern, Indo-European, Italic, Romance, Italo-Western, Italo-Dalmatian, Indo-European, Germanic, West, High German, German, Middle German, East Middle German, Indo-European, Slavic, East",Indo-European,§,,"Eurasia, Eurasia, Eurasia, Eurasia, Eurasia, Eurasia, Eurasia, Eurasia, Eurasia, Eurasia",,2016-3-30,,
Ibrahim_20160229_fra+dje+gux+ful+mey+taq,Ibrahim_Najum_20160229,Teddy_Nee_20141005,2/29/2016,"""Ibrahim_s6__20160229_fra,ara,tmh,dje,gux,ful.png (https://dl.airtable.com/3mICF6gSpqKNI67efpQd_Ibrahim_s6__20160229_fra%2Cara%2Ctmh%2Cdje%2Cgux%2Cful.png)""","""Ibrahim_s6__20160229_fra,ara,tmh,dje,gux,ful.jpg (https://dl.airtable.com/Q1FhmenLR8qIApKmwcll_Ibrahim_s6__20160229_fra%2Cara%2Ctmh%2Cdje%2Cgux%2Cful.jpg)""","fra,dje,gux,ful,mey,taq",,"French, Zarma, Gourmanchéma, Fulah, Hassaniyya, Tamasheq",,,,,5/11/2016,Public,Standard,,,,,,Get a free French lesson with italki: http://promos.italki.com/wikitongues_fra,6 checked out of 6,,31,,,,6,checked,7EJud2CMRyo,https://youtu.be/7EJud2CMRyo,"60,000,000 in France (ELDIA 2012). Population total all countries: 74,980,460., 2,350,000 in Niger (2006). Population total all countries: 2,438,900., 600,000 in Burkina Faso (1999 SIL). Population total all countries: 813,000., Population total all languages: 22,331,400., 2,770,000 in Mauritania (2006), increasing. Population total all countries: 3,278,190., 250,000 in Mali (1991). Population total all countries: 281,200.","Indo-European, Italic, Romance, Italo-Western, Western, Gallo-Iberian, Gallo-Romance, Gallo-Rhaetian, Oïl, French, Nilo-Saharan, Songhai, Southern, Niger-Congo, Atlantic-Congo, Volta-Congo, North, Gur, Central, Northern, Oti-Volta, Gurma, Afro-Asiatic, Semitic, Central, South, Arabic, Afro-Asiatic, Berber, Tamasheq, Southern",Indo-European,§,,"Eurasia, Eurasia, Americas, Eurasia, Eurasia, Africa, Africa, Africa, Africa, Africa",,2016-3-30,,
Stéfane_20161205_jpn+fra+eng+por,Stéfane_Hélder_20161130,Stefan_Hélder_,12/5/2016,Stéfane_20161205_jpn+fra+eng+por.png (https://dl.airtable.com/vrPy4d2zRzejxh9Xs6k4_Ste%CC%81fane_20161205_jpn%2Bfra%2Beng%2Bpor.png),Stefane_20161205_jpn+fra+eng+por.jpg (https://dl.airtable.com/3E8mAYeQJuDgmYKp93Je_Stefane_20161205_jpn%2Bfra%2Beng%2Bpor.jpg),"jpn,fra,eng,por",,"Japanese, French, English, Portuguese",,,,,9/28/2017,Public,Standard,,,,,,"Get a free Japanese lesson with italki: http://promos.italki.com/wikitongues_jpn, Get a free French lesson with italki: http://promos.italki.com/wikitongues_fra, Get a free English lesson with italki: http://promos.italki.com/wikitongues_eng, Get a free Portuguese lesson with italki: http://promos.italki.com/wikitongues_por",4 checked out of 4,,,,,,4,,8jAAPdvTld0,https://youtu.be/8jAAPdvTld0,"121,000,000 in Japan (1985). Population figure may include other ethnic groups. Population total all countries: 122,056,940. L2 users: 1,000,000 in Japan., 60,000,000 in France (ELDIA 2012). Population total all countries: 74,980,460., 55,600,000 in United Kingdom (ELDIA 2012). Population total all countries: 335,148,868. L2 users: 1,500,000 in United Kingdom (Crystal 2003). L2 users worldwide: 505,000,000., 10,000,000 in Portugal (ELDIA 2012). Population total all countries: 203,349,200.","Japonic, Indo-European, Italic, Romance, Italo-Western, Western, Gallo-Iberian, Gallo-Romance, Gallo-Rhaetian, Oïl, French, Indo-European, Germanic, West, English, Indo-European, Italic, Romance, Italo-Western, Western, Gallo-Iberian, Ibero-Romance, West Iberian, Portuguese-Galician",Japonic,§,,"Eurasia, Eurasia, Eurasia, Americas, Eurasia, Eurasia, Eurasia, Eurasia, Eurasia, Eurasia",,2016-12-5,,
Labaram_20160702_bqg,Labaram__20160702,Sophia_Leenay_,7/2/2016,Screen Shot 2016-09-02 at 4.58.48 PM.png (https://dl.airtable.com/jkdoBmhHQFaij0fhi7Xs_Screen%20Shot%202016-09-02%20at%204.58.48%20PM.png),Labaram_s1_M_20160702_bqg.jpg (https://dl.airtable.com/5kxuKwGQNyZzM7g2jqJq_Labaram_s1_M_20160702_bqg.jpg),bqg,,Bago-Kusuntu,Koussountou,,,,9/3/2016,Public,Standard,,,,,,,1 checked out of 1,,,,,,1,,YTgDOQuuvdc,https://youtu.be/YTgDOQuuvdc,"7,500 (2000). Ethnic population: 8,000.","Niger-Congo, Atlantic-Congo, Volta-Congo, North, Gur, Central, Southern, Grusi, Eastern",Niger-Congo,§Koussountou,,Africa,,2016-7-5,,
Isaaka_20160628_kdh,Isaaka_Ouro-Wetchire_20160628,Sophia_Leenay_,6/28/2016,Isaaka_s1_M_20160628_kdh.png (https://dl.airtable.com/kiUiaAPHRGpqXMmsfPV4_Isaaka_s1_M_20160628_kdh.png),Isaaka_s1_M_20160628_kdh.jpg (https://dl.airtable.com/I5ev6xoGRYuy4d9dX4KR_Isaaka_s1_M_20160628_kdh.jpg),kdh,,Tem,,,,,11/17/2016,Public,Standard,,,,,,,1 checked out of 1,,,,,,1,,TPWT57Wuwac,https://youtu.be/TPWT57Wuwac,"204,000 in Togo (1991). Population total all countries: 307,000.","Niger-Congo, Atlantic-Congo, Volta-Congo, North, Gur, Central, Southern, Grusi, Eastern",Niger-Congo,§,,Africa,,2016-7-5,,
Navas_20160925_-byu,Navas__20160925,Sidhique_Kappan_,9/25/2016,Screen Shot 2016-11-29 at 19.21.52.png (https://dl.airtable.com/dryNBzI2SFaVc6LvgniL_Screen%20Shot%202016-11-29%20at%2019.21.52.png),Navas_s1_M_20160925_-byu.jpg (https://dl.airtable.com/UbYvRM01S3e53aIysRb5_Navas_s1_M_20160925_-byu.jpg),-byu,,Beary,Byari,,,,11/29/2016,Public,CC BY-NC 3.0,checked,,,,,,1 checked out of 1,,,,,,1,,pmwUGyC-Hh0,https://youtu.be/pmwUGyC-Hh0,,,,§Byari,,Eurasia,,2016-9-26,,
Nitesh_20160614_bgc,Nitesh__20160614,Satdeep_Gill_,6/14/2016,Nitesh_s1_F_20160614_bgc.png (https://dl.airtable.com/06TF2JC7TCqCFtutw9QE_Nitesh_s1_F_20160614_bgc.png),Nitesh_s1_F_20160614_bgc.jpg (https://dl.airtable.com/vykd9zPSuW5Y9JPO0fP1_Nitesh_s1_F_20160614_bgc.jpg),bgc,eng,Haryanvi,,,,,7/9/2016,Public,CC BY-SA 4.0,checked,,,,,,1 checked out of 1,,,Facebook,2018-1-12,https://www.facebook.com/wikitongues/videos/1694236013974252/,1,,a0TKySIPH0E,https://youtu.be/a0TKySIPH0E,"8,000,000 (2001 census). Ethnic population: 16,000,000 (1992 SIL).","Indo-European, Indo-Iranian, Indo-Aryan, Central zone, Western Hindi, Unclassified",Indo-European,§,,Eurasia,,2016-6-14,,https://www.dropbox.com/sh/slwg2kb63y98kzm/AABT8QAimtj2dPgzfTTwdpdCa?dl=0
Raphael_20160721_aka,Raphael__20160721,Satdeep_Gill_,7/21/2016,Screen Shot 2016-08-12 at 14.06.51.png (https://dl.airtable.com/Ca8XZpVkRAez5VcyFN7A_Screen%20Shot%202016-08-12%20at%2014.06.51.png),Raphael_s1_M_20160721_aka.jpg (https://dl.airtable.com/fY2T9oCmTharPg2SDxB9_Raphael_s1_M_20160721_aka.jpg),aka,,Akan,Twi,"Twi ISO to be reconciled when we update database in accordance with ISO

",Classification,,8/12/2016,Public,CC BY-SA 4.0,checked,,,,,,1 checked out of 1,,,,,,1,,zUDEten_j9o,https://youtu.be/zUDEten_j9o,"8,300,000 in Ghana (2004 SIL). Population includes 2,800,000 Asante Twi, 1,900,000 Fante, 555,000 Akuapem Twi (2004). Population total all countries: 8,314,600. L2 users: 1,000,000 in Ghana.","Niger-Congo, Atlantic-Congo, Volta-Congo, Kwa, Nyo, Potou-Tano, Tano, Central, Akan",Niger-Congo,§Twi,,Africa,,2016-7-22,,
Mohammad_20160721_bqi,Mohammad__20160721,Satdeep_Gill_,7/21/2016,Screen Shot 2016-11-02 at 22.04.20.png (https://dl.airtable.com/Ao78yZJKTheH1mPQNt1c_Screen%20Shot%202016-11-02%20at%2022.04.20.png),Mohammad_s1_M_20160721_bqi.jpg (https://dl.airtable.com/dUA8EgqdRIu5LgYDIYRF_Mohammad_s1_M_20160721_bqi.jpg),bqi,eng,Bakhtiâri,Bakhtiari Farsi,,,,11/2/2016,Public,CC BY-SA 4.0,checked,,,,,,1 checked out of 1,,,,,,1,,oMeQ8llXq6o,https://youtu.be/oMeQ8llXq6o,"1,000,000 (2001). 350,000 monolinguals. Ethnic population: 1,000,000 (2001).","Indo-European, Indo-Iranian, Iranian, Western, Southwestern, Luri",Indo-European,§Bakhtiari Farsi,,Eurasia,,2016-7-22,,
Mounir_20160721_aeb,Mounir__20160721,Satdeep_Gill_,7/21/2016,Screen Shot 2017-01-18 at 14.25.09.png (https://dl.airtable.com/sCRwwwXUSyGMW18vFPeH_Screen%20Shot%202017-01-18%20at%2014.25.09.png),Mounir_s1_M_20160721_aeb.jpg (https://dl.airtable.com/5dieSmMPQGG7J9SY5Q8Z_Mounir_s1_M_20160721_aeb.jpg),aeb,,"Arabic, Tunisian Spoken",Tunisian Arabic,,,,1/19/2017,Public,CC BY-SA 4.0,checked,,,,,,1 checked out of 1,,,,,,1,,qxXq9iP-CGw,https://youtu.be/qxXq9iP-CGw,"9,000,000 in Tunisia (1995). Population total all countries: 9,406,900.","Afro-Asiatic, Semitic, Central, South, Arabic",Afro-Asiatic,§Tunisian Arabic,,Africa,,2016-7-22,,
Krishna_20160721_bho,Krishna__20160721,Satdeep_Gill_,7/21/2016,Screen Shot 2017-01-31 at 16.19.36.png (https://dl.airtable.com/g3sfPtjSPWcdUU15hRdA_Screen%20Shot%202017-01-31%20at%2016.19.36.png),Krishna_s1_M_20160721_bho.jpg (https://dl.airtable.com/qw1vjPjxTV2wS03RuKcG_Krishna_s1_M_20160721_bho.jpg),bho,,Bhojpuri,,,,,2/23/2017,Public,CC BY-SA 4.0,checked,,,,,,1 checked out of 1,,,,,,1,,c05NPQFxnlc,https://youtu.be/c05NPQFxnlc,"37,800,000 in India (2001 census). Population total all countries: 39,716,000.","Indo-European, Indo-Iranian, Indo-Aryan, Eastern zone, Bihari",Indo-European,§,,Eurasia,,2016-7-22,,
Raj_20160622_bgq,Raj_Kamal_20160622,Satdeep_Gill_,6/22/2016,Raj_20160622_bgq.png (https://dl.airtable.com/8Vsr2HIRKj8BO3zajrQ8_Raj_20160622_bgq.png),Raj_20160622_bgq.jpg (https://dl.airtable.com/T2iiQvLRLWVGZZlIWdFE_Raj_20160622_bgq.jpg),bgq,eng,Bagri,,,,,9/19/2017,Public,CC BY-SA 4.0,,,,,,,1 checked out of 1,,,,,,1,,F4xgvj4kSnU,https://youtu.be/F4xgvj4kSnU,"647,000 in India (2001 census). Population total all countries: 847,000. 162,000 monolinguals.","Indo-European, Indo-Iranian, Indo-Aryan, Central zone, Rajasthani, Unclassified",Indo-European,§," This video was recorded by Satdeep Gill in Patiala, Punjab, India, where Raj lives and studies. Bagri is spoken by at least two million people, primarily in the north Indian states of Rajasthan, Punjab, and Haryana. An Indo-European language of the Indo-Aryan linguistic family, it is considered by linguists to be a member of the Rajasthani subgroup, bearing close resemblance to several other languages, including Marwari, Malvi, and Mewati. As such, these mother tongues are sometimes described as dialects of a single ‘Rajasthani language’. Politically, Bagri is only recognized in the latter form, as ‘Rajasthani’ is one of Rajasthan’s official languages. As Bagri, the language goes unrecognized, though still actively spoken nonetheless.",Eurasia,,2016-6-22,,https://www.dropbox.com/sh/ym4rhp7441s45j7/AAB8thn6Poml7EDxG-GXr8oYa?dl=0
Valentine_20160713_ibo,Valentine__20160713,Noah_Sullivan_20160610,7/13/2016,,Valentine_s1_M_20160713_ibo.jpg (https://dl.airtable.com/eMagrMYaTsOgd3xZXsng_Valentine_s1_M_20160713_ibo.jpg),ibo,,Igbo,,,,,9/9/2016,Public,CC BY-NC 3.0,,,,,,,1 checked out of 1,,,,,,1,,iXUwLs4kNvc,https://youtu.be/iXUwLs4kNvc,"18,000,000 (Wiesenfeld 1999).","Niger-Congo, Atlantic-Congo, Volta-Congo, Benue-Congo, Igboid, Igbo",Niger-Congo,§,,Africa,,2016-7-13,,
Noah_20160610_eng+gle,Noah_Sullivan_20160610,Noah_Sullivan_20160610,6/10/2016,Screen Shot 2016-12-02 at 13.07.59.png (https://dl.airtable.com/vmvCZNhWQWODmppkgSu4_Screen%20Shot%202016-12-02%20at%2013.07.59.png),Noah_s2_M_20160610_eng+gle.jpg (https://dl.airtable.com/ZwK6u3TKSbmlZ1DmnuSW_Noah_s2_M_20160610_eng%2Bgle.jpg),"eng,gle",,"English, Irish",,,,,12/2/2016,Public,CC BY-NC 3.0,checked,,,,,"Get a free English lesson with italki: http://promos.italki.com/wikitongues_eng, Get a free Irish lesson with italki: http://promos.italki.com/wikitongues_gle",2 checked out of 2,,,,,,2,,TzN8Kl3SBME,https://youtu.be/TzN8Kl3SBME,"55,600,000 in United Kingdom (ELDIA 2012). Population total all countries: 335,148,868. L2 users: 1,500,000 in United Kingdom (Crystal 2003). L2 users worldwide: 505,000,000., 138,000 in Ireland (ELDIA 2012). Population total all countries: 276,310. L2 users: 1,000,000 in Ireland (ELDIA 2012).","Indo-European, Germanic, West, English, Indo-European, Celtic, Insular, Goidelic",Indo-European,§,,"Eurasia, Eurasia, Eurasia",,2016-6-22,,
Ngawang_20161226_tsj,Ngawang_Zepa_20161226,"Phurba_Wangdi_,Ngawang_Zepa_",12/26/2016,,,tsj,,Tshangla,,,,,,To Upload,CC BY-NC 3.0,checked,,,,,,1 checked out of 1,,,,,,1,,,No ID,"140,000 in Bhutan (1999 SIL). Population total all countries: 158,200.","Sino-Tibetan, Tibeto-Burman, Western Tibeto-Burman, Bodish",Sino-Tibetan,§,,Eurasia,,2016-12-27,,
Manuel_20161114_yua,Manuel_Poot_20161114,Nat_Pendleton_20161101,11/14/2016,,,yua,,"Maya, Yucatec",,,,,,To Upload,CC BY-SA 4.0,,,,,,,1 checked out of 1,,,,,,1,,,No ID,"735,000 in Mexico (2000 INALI). Population total all countries: 766,000. 58,800 monolinguals (2007).","Mayan, Yucatecan-Core Mayan, Yucatecan, Yucatec-Lacandon",Mayan,§,,Americas,,2016-11-17,,
Nat_20161101_yua,Nat_Pendleton_20161101,Nat_Pendleton_20161101,11/1/2016,,,yua,,"Maya, Yucatec",,,,,,To Upload,CC BY-NC 3.0,checked,,,,,,1 checked out of 1,,,,,,1,,,No ID,"735,000 in Mexico (2000 INALI). Population total all countries: 766,000. 58,800 monolinguals (2007).","Mayan, Yucatecan-Core Mayan, Yucatecan, Yucatec-Lacandon",Mayan,§,,Americas,,2016-11-17,,
Hilario_20161101_yua,Hilario_ChiCanul_20161101,Nat_Pendleton_20161101,11/1/2016,Hilario_s1_M_20161101_yua.png (https://dl.airtable.com/IlBgZdcR1KzpNreLMYSo_Hilario_s1_M_20161101_yua.png),Hilario_s1_M_20161101_yua.jpg (https://dl.airtable.com/bjik2b3pTZCqwR4Lnhlj_Hilario_s1_M_20161101_yua.jpg),yua,,"Maya, Yucatec",,,,,12/11/2016,Public,CC BY-NC 3.0,,,"[First I asked him what work he did with Apocalypto, then he describes that work in these words) Tene' ti' Apocalyptoe', ba'ax tin beetaje'... Tin beetaj jun p'éel sut ts'íib, tuláakal u analte'il Apocalypto beeta'abe' (...) ka taalen túun t'anbile', ka a'alab ten ka xi'iken in wil le meyaj beeta'abo', tumen túun ts'oka'an u su'utul ka'ach ich maaya, chen ba'axe' a'ala'abe' le maaya yaan te'elo' k'a'ana'an u yila'al tumen jun túul máak jach jach u yáax t'aanae' maaya, ka'ap u máan kaxbil tuláakal yóok'ol lu'um, ka beeta'ab casting Estados Unidos, México, Candá te' tu'ux ojelta'an yaan maaya'obo', ka k'ucho'ob wey Cancúune' ka binen in beet casting (a casting call). In túukul ka'ache' táak ka'ach in jóok'ol te' cha'ano', je'ex actor , jaaj wa je ba'ax bey taak u beeta'alo', ts'áa e'esaj bix u ya'ala'alo'. Je'elo', kin wa'alike', pus ma' in wóojel bix úuch u jóok'ol beyo', tene' ka binene' ka'ap in wa'alik ti'obe', tene' in wóojel maaya, kin t'anik maaya, yaan ten mejen meyajo'ob in beetmaj tu yóok'ol maaya'ob tu'ux ka'ach tin xooke', ti' in we'esik bix yanik le paalitsiltalo', wa le esclavitud; le paalitsilil ku ya'ala'al úuchilo', Je'elo', ka'ap in we'esik túun ti'ob in mejen meyaj bey ti'obo', le mejen videoo', le táabsaj óochelo'ob beyo', ka tu yilo'ob. Mij jach... mij jach ich u wi'inalil octubre ka taalen t'anbil, ka a'alab tene' tin t'a'anal Méejico ka xi'iken in wil le meyajo', ts'oka'an u beeta'al, chen ba'axe' je'el u páajtal in meyaj xane', ka a'ala'ab tene' chen óox p'éel k'iin:\&quot;táas a nook' chen ti' óox p'éel k'íin\&quot;, ken ts'o'okoke' ka ka'a suut, ka binen Méejico, ka binen in wa'al ti' in na' yéetel in láak'o'ob yano'ob Naranjal Poniente, kajakbalo'ob yáanal ts'u' k'áax te' báantaa. Je'elo', ka binen, ka k'uchen túun tu noj kaajil Méejicoe' ka káaj in meyaj, ka ila'ab bix in meyaje', ka a'ala'ab tene' ma' an bin hasta u ts'o'ol le meyaja'.","Hilario talks of his experience as the voice coach for the actors in Mel Gibson\&#039;s Apocalypto. The film needed to have a genuine Maya script, so he reviewed the script and made it genuine. Hilario knew and knows Maya the way it used to be and this is what he taught. (Pre-hispanic Maya: note that modern Maya uses several Spanish loan words.) /// He taught actors from various Indian Nations (from the US, Canada and Mexico) how to pronounce their lines in Yucatec Maya. They had to look all over the world to find some one who had a full depth knowledge of (pre-hispanic) Maya. For example, the word Slavery or paalitsilil as it was called previously (previous to Spanish invasion). He went to a casting call in Cancun, was selected and then he went to Mexico City to get the script. Then in a period of 3 days after checking with his family in Naranjal Poniente, he produced a (revised, pure Maya) script and went back to Mexico where he stayed until he finished the work (of teaching the actors to pronounce and speak Maya correctly).
Optional Message: Here ",,,1 checked out of 1,,,,,,1,,z8eTwjQCCuA,https://youtu.be/z8eTwjQCCuA,"735,000 in Mexico (2000 INALI). Population total all countries: 766,000. 58,800 monolinguals (2007).","Mayan, Yucatecan-Core Mayan, Yucatecan, Yucatec-Lacandon",Mayan,§,,Americas,,2016-11-17,,
