Nila_20151008_jav,Nila__20150321,LuisMiguel_Rojas-Berscia_,10/8/2015,nila-javabsind-thumb-raw.png (https://dl.airtable.com/wNIxIW4URzSFMaZ4oNG1_nila-javabsind-thumb-raw.png),Nila_s1_F_20151008_jav.jpg (https://dl.airtable.com/lkyhjaJfRiWJyqF2t7Ag_Nila_s1_F_20151008_jav.jpg),jav,,Javanese,,,,Netherlands,10/8/2015,Public,Standard,,,,,,,1 checked out of 1,,,,,,1,checked,eg0bYuuHzkI,https://youtu.be/eg0bYuuHzkI,"84,300,000 in Indonesia (2000 census). 25,000 in south Sulawesi, and 69,000,000 on Java, 500,000 of them being in Banten region and 2,500,000 in Cirebon region of Java. Population total all countries: 84,308,740.","Austronesian, Malayo-Polynesian, Javanese",Austronesian,"Javanese,,,,,",,Eurasia,,2015-2-15,,
Nila_20151212_ind,Nila__20150321,LuisMiguel_Rojas-Berscia_,12/12/2015,nila-javabsind-thumb-raw.png (https://dl.airtable.com/wGYAbYRZReWuEiyNJy3w_nila-javabsind-thumb-raw.png),maxresdefault (7).jpg (https://dl.airtable.com/uBY2bSdAQym6zdLXk8bQ_maxresdefault%20(7).jpg),ind,,Indonesian,Bahasa Indonesia,,,Netherlands,12/12/2015,Public,Standard,,,,,,Get a free Indonesian lesson with italki: http://promos.italki.com/wikitongues_ind,1 checked out of 1,,,,,,1,checked,Er4liSo00nA,https://youtu.be/Er4liSo00nA,"22,800,000 in Indonesia (2000), increasing. Population total all countries: 23,200,480. L2 users: 140,000,000 in Indonesia.","Austronesian, Malayo-Polynesian, Malayo-Chamic, Malayic, Malay",Austronesian,"Indonesian,,,,,",,Eurasia,,2015-2-15,,
SisterCookson_20161025_mri,SisterCookson__20161025,Argo_Cayhadi_20150418,10/25/2016,Screen Shot 2017-06-01 at 13.51.22.png (https://dl.airtable.com/hR5AYOlQmfUhRYsT1omQ_Screen%20Shot%202017-06-01%20at%2013.51.22.png),Sister_s1_F_20161025_mri.png (https://dl.airtable.com/dEyIiaAnQM6f0SMF57iF_Sister_s1_F_20161025_mri.png),mri,eng,Maori,,,,New Zealand,6/27/2017,Public,CC BY-NC 3.0,checked,,,,,,1 checked out of 1,,,,,,1,,pBksbW_fXKo,https://youtu.be/pBksbW_fXKo,"148,000 in New Zealand (2013 census). 100,000 understand but do not speak it (1995 Maori Language Commission); 30,000–50,000 adult speakers over 15 years old (1995). Population total all countries: 148,660. Ethnic population: 599,000 (2013 census).","Austronesian, Malayo-Polynesian, Central-Eastern Malayo-Polynesian, Eastern Malayo-Polynesian, Oceanic, Central-Eastern Oceanic, Remote Oceanic, Central Pacific, East Fijian-Polynesian, Polynesian, Nuclear, East, Central, Tahitic",Austronesian,Maori,"This video was recorded by Argo Cayhadi in Kingsford, New South Wales, Australia. Maori is spoken by as many as 150,000 people, primarily in the Polynesian nation of New Zealand, where it is official alongside English and New Zealand Sign Language. A literary language since the 1800s, Maori is written with the Latin alphabet. Though the language fell into decline in the decades after the Second World War, Maori activists began cultivating a revival movement in the 1980s, which has continued to develop since the turn of the 21st century. In addition to increased government recognition, Maori immersion schools, as well as Maori use in media, are increasingly commonplace.",Oceania,,2016-10-26,,https://www.dropbox.com/sh/ohqfm0om4bei8sn/AABXmml-dj2mcZdbkZCIqGTXa?dl=0
Ali_20150626_hau+kau,Ali__20150626,Orsi_Jenei_,6/26/2015,ali-haukau-thumb-raw.png (https://dl.airtable.com/RJagELfCSgir77Lfjw9d_ali-haukau-thumb-raw.png),Ali_s2_M_20150626_kau+hau.jpg (https://dl.airtable.com/f5MkfP0TT5GFy9WcFlKR_Ali_s2_M_20150626_kau%2Bhau.jpg),"hau,kau",,"Hausa, Kanuri",,,,Niger,7/28/2015,Public,CC BY-NC 3.0,,,,,,,2 checked out of 2,,,Facebook,2016-6-2,https://www.facebook.com/wikitongues/videos/1122703401127519/,2,checked,mCghaYzVDxw,https://youtu.be/mCghaYzVDxw,"18,500,000 in Nigeria (1991 SIL). Population total all countries: 24,988,000. L2 users: 15,000,000 in Nigeria., Population total all languages: 3,760,500.","Afro-Asiatic, Chadic, West, A, A.1",Afro-Asiatic,"Hausa,Kanuri,,,,",,"Africa, Africa",,2015-6-28,,
Golala_20170928_ckb,Golala__20170928,Irena_Dahl_20160517,9/28/2017,Screen Shot 2017-11-05 at 5.08.40 PM.png (https://dl.airtable.com/oLmIHXFjSIOi40LgjCwx_Screen%20Shot%202017-11-05%20at%205.08.40%20PM.png),Golala_20170928_ckb.png (https://dl.airtable.com/XMSdpzg3Q8y3pbZLJi34_Golala_20170928_ckb.png),ckb,eng,"Kurdish, Central",Sorani Kurdish,,,Norway,11/14/2017,Public,CC BY-SA 4.0,checked,,,,Recorded in Oslo,,1 checked out of 1,,,,,,1,,ftqet7jH91g,https://youtu.be/ftqet7jH91g,"3,500,000 in Iraq (2009). Population total all countries: 6,750,000.","Indo-European, Indo-Iranian, Iranian, Western, Northwestern, Kurdish",,,"This video was recorded by Irena Dahl in Oslo, Norway, where she and Golala live. Sorani Kurdish, known natively as Soranî (سۆرانی) and by researchers as Central Kurdish, is spoken by as many as seven million people, primarily in Iraqi Kurdistan, where it is an official language alongside Standard Arabic, as well as in Kurdish Iran. An Indo-European language of the Iranian family, it is perhaps most closely related to Farsi, and more distantly to languages as diverse as Hindi and English. Though Kurdish has been used in literature since at least the 16th century CE, it wasn’t until the 1990s that the language featured prominently in mass media, thanks to the autonomy of Iraqi Kurdistan. Consequently, Soranî has been the primary Kurdish variety in film, television, and radio. It is also used online, with the .krd top-level domain for Kurdish websites.",Eurasia,,2017-10-1,,https://www.dropbox.com/sh/08lz75jzqyizweo/AADUxfiWk6Krl5EJY-PS4NrMa?dl=0
Anna_20160803_sjd,Anna__20160803,Irena_Dahl_,8/3/2016,Screen Shot 2016-08-30 at 1.52.49 PM.png (https://dl.airtable.com/KJrGJBSTRfCv892RQ82D_Screen%20Shot%202016-08-30%20at%201.52.49%20PM.png),Anna_s1_F_20160803_sjd.jpg (https://dl.airtable.com/xxLcMPQ3yuz6oBLz0fuQ_Anna_s1_F_20160803_sjd.jpg),sjd,"eng,rus","Saami, Kildin",,,,Norway,9/7/2016,Public,Standard,,,,,,,1 checked out of 1,,,,,,1,,8i4EEb5QMgU,https://youtu.be/8i4EEb5QMgU,"350 (2010 census). Census includes Skolt Saami , and Ter Saami ,. Ethnic population: 1,770 (2010 census). Number includes all Saami.","Uralic, Sami, Eastern",Uralic,§,,Eurasia,,2016-8-5,,https://www.dropbox.com/sh/ukagvfm592anuf2/AAD85bH_Wmv89Govvrcqzk1da?dl=0
Simon_20160707_smj,Simon_Piera_20160707,Irena_Dahl_,7/7/2016,Simon_s1_M_20160707_smj.png (https://dl.airtable.com/RZ4zbQBnSte2aStL4b4e_Simon_s1_M_20160707_smj.png),Simon_s1_M_20160707_smj.jpg (https://dl.airtable.com/tsU5GuvnTTak8zO66yQ2_Simon_s1_M_20160707_smj.jpg),smj,,"Saami, Lule",,,,Norway,9/29/2016,Public,Standard,,,,,,,1 checked out of 1,,,,,,1,,wKPuXCb_Vlg,https://youtu.be/wKPuXCb_Vlg,"1,500 in Sweden (Krauss 1992). 1,000–2,000 speakers in Norway and Sweden (Salminen 2007). Population total all countries: 2,000. Ethnic population: 6,000.","Uralic, Sami, Western, Northern",Uralic,§,,Eurasia,,2016-8-5,,
Zaeem_20160721_hnd+pbu,Zaeem__20160721,Satdeep_Gill_,7/21/2016,Screen Shot 2017-06-01 at 13.49.21.png (https://dl.airtable.com/3GispQb6SxeO2etCeEzo_Screen%20Shot%202017-06-01%20at%2013.49.21.png),Zaeem_s2_M_20160721_hnd+pbu.png (https://dl.airtable.com/p8v8yZMKS4Su2Y75Zv2z_Zaeem_s2_M_20160721_hnd%2Bpbu.png),"hnd,pbu",,"Hindko, Southern, Pashto, Northern",,,,Pakistan,6/24/2017,Public,CC BY-SA 4.0,checked,,,,,"Get a free Pashto, Northern lesson with italki: http://promos.italki.com/wikitongues_pbu",2 checked out of 2,,,Facebook,2017-7-26,https://www.facebook.com/wikitongues/videos/1529058067158715/,2,,stVATHE414E,https://youtu.be/stVATHE414E,"625,000 (1981 census)., 18,700,000 in Pakistan (2013 SIL). Population total all countries: 20,540,000. Ethnic population: Possibly 49,600,000 Pashto in all countries.","Indo-European, Indo-Iranian, Indo-Aryan, Northwestern zone, Lahnda, Indo-European, Indo-Iranian, Iranian, Eastern, Southeastern, Pashto",Indo-European,"Hindko,Pashto","This video was recorded by Satdeep Gill in Esino Lario, Italy, where he and Zaeem were visiting for the Wikimania 2016 conference. Hindko is spoken by as many as 625,000 people, primarily in Pakistan's western provinces of Punjab and Khyber Pakhtunkhwa. A Punjabi language, it shares similarities with a variety of mother tongues spoken throughout western Pakistan and Eastern India. Pashto is spoken by as many as 60 million people, primarily by the Pashtun people of Afghanistan and Pakistan, and by several other communities as a regional lingua franca. Zaeem's native variety of Northern Pashto, spoken by some 20 million people, is sometimes also referred to as Pekhawari.","Eurasia, Eurasia",,2016-7-22,,
Oluchel_20160824_pau,Oluchel__20160824,Elise_Lieberman_20160622,8/24/2016,Screen Shot 2017-03-01 at 15.17.45.png (https://dl.airtable.com/83J4vmBgSue69zMHHsZ5_Screen%20Shot%202017-03-01%20at%2015.17.45.png),Oluchel_s1_F_20160824_pau.jpg (https://dl.airtable.com/yaFi3yRrTd2QljbAPqzk_Oluchel_s1_F_20160824_pau.jpg),pau,,Palauan,,,,Palau,3/2/2017,Public,CC BY-NC 3.0,,,,,,,1 checked out of 1,,,Facebook,2017-6-23,https://www.facebook.com/wikitongues/videos/1478789915518864/,1,,bwx4tkODJm8,https://youtu.be/bwx4tkODJm8,"14,800 in Palau (2000). Population total all countries: 18,950.","Austronesian, Malayo-Polynesian, Palauan",Austronesian,§,,Oceania,,2016-8-25,,
Gilberta_20171127_acr,Gilberta_GonzalesVasquez_20171127,Daniel_BogreUdell_20130101,11/27/2017,,,acr,,Achi,,,,Peru,,To Upload,CC BY-NC 3.0,,,,,,,1 checked out of 1,,,,,,1,,,No ID,85600,"Mayan, Yucatecan-Core Mayan, K’ichean-Mamean, K’ichean, Poqom-K’ichean, Core K’ichean",,,,Americas,,2017-11-27,,
Eugenia_20171127_ayc,Eugenia_MamniChoque_20171127,Daniel_BogreUdell_20130101,11/27/2017,,,ayc,,"Aymara, Southern",Southern Aymara,,,Peru,,To Upload,CC BY-NC 3.0,,,,,,,1 checked out of 1,,,,,,1,,,No ID,"219,000 (2006).","Aymaran, Aymara",,,,Americas,,2017-11-27,,
Marcelina_20161127_ayc,Marcelina_ChoqueCastro_,Daniel_BogreUdell_20130101,11/27/2016,,,ayc,,"Aymara, Southern",Southern Aymara,,,Peru,,To Upload,CC BY-NC 3.0,,,,,,,1 checked out of 1,,,,,,1,,,No ID,"219,000 (2006).","Aymaran, Aymara",,,,Americas,,2017-11-27,,
Nely_20171127_ayc,Nely_CastroMamani_20171127,Daniel_BogreUdell_20130101,11/27/2017,,,ayc,,"Aymara, Southern",Southern Aymara,,,Peru,,To Upload,CC BY-NC 3.0,,,,,,,1 checked out of 1,,,,,,1,,,No ID,"219,000 (2006).","Aymaran, Aymara",,,,Americas,,2017-11-27,,
Sonia_20171127_boa,Sonia_VegaTorres_20171127,Daniel_BogreUdell_20130101,11/27/2017,,,boa,,Bora,Booráá,,,Peru,,To Upload,CC BY-NC 3.0,,,,,,,1 checked out of 1,,,,,,1,,,No ID,"2,330 in Peru (2000). Population total all countries: 2,430. Ethnic population: 3,000 (Crevels 2007).","Witotoan, Proto-Bora-Muinane",,,,Americas,,2017-11-27,,
Nilo_20171127_cod,Nilo_YahuarcaniRomanya_20171127,Daniel_BogreUdell_20130101,11/27/2017,,,cod,,Cocama-Cocamilla,Kukama,,,Peru,,To Upload,CC BY-NC 3.0,,,,,,,1 checked out of 1,,,,,,1,,,No ID,"250 in Peru (Crevels 2007). Few monolinguals. Ethnic population: 15,000 (Crevels 2007).","Tupian, Tupí-Guaraní, Tupí, Cocama",,,,Americas,,2017-11-27,,
Amalaia_20171127_kek,Amalaia_Gue_20171127,Daniel_BogreUdell_20130101,11/27/2017,,,kek,,Q’eqchi’,,,,Peru,,To Upload,CC BY-NC 3.0,,,,,,,1 checked out of 1,,,,,,1,,,No ID,"800,000 in Guatemala (2009 SIL), increasing. Population total all countries: 823,500.","Mayan, Yucatecan-Core Mayan, K’ichean-Mamean, K’ichean",,,,Americas,,2017-11-27,,
Carmen_20171127_kek,Carmen_PoouBe_20171127,Daniel_BogreUdell_20130101,11/27/2017,,,kek,,Q’eqchi’,,,,Peru,,To Upload,CC BY-NC 3.0,,,,,,,1 checked out of 1,,,,,,1,,,No ID,"800,000 in Guatemala (2009 SIL), increasing. Population total all countries: 823,500.","Mayan, Yucatecan-Core Mayan, K’ichean-Mamean, K’ichean",,,,Americas,,2017-11-27,,
Zakiya_20171127_kfr,Zakiya_AdilKhatri_20171127,Daniel_BogreUdell_20130101,11/27/2017,,,kfr,,Kachchi,,,,Peru,,To Upload,CC BY-NC 3.0,,,,,,,1 checked out of 1,,,,,,1,,,No ID,"823,000 in India (2001 census). Population total all countries: 873,000.","Indo-European, Indo-Iranian, Indo-Aryan, Northwestern zone, Sindhi",,,,Eurasia,,2017-11-27,,
Wanthong_20171128_khb,Wanthong__20171128,Daniel_BogreUdell_20130101,11/28/2017,,,khb,,Lü,,,,Peru,,To Upload,CC BY-NC 3.0,,,,,,,1 checked out of 1,,,,,,1,,,No ID,"280,000 in China (2000 census). Population total all countries: 550,960. 140,000 monolinguals.","Tai-Kadai, Kam-Tai, Tai, Southwestern",,,,Eurasia,,2017-11-28,,
Noot_20171127_lao,Noot__20171127,Daniel_BogreUdell_20130101,11/27/2017,,,lao,,Lao,,,,Peru,,To Upload,CC BY-NC 3.0,,,,,,,1 checked out of 1,,,,,,1,,,No ID,"3,070,000 in Laos (2005 census). Population total all countries: 3,273,180. L2 users: 800,000 in Laos.","Tai-Kadai, Kam-Tai, Tai, Southwestern",,,,Eurasia,,2017-11-27,,
Kham_20171127_mji,Kham__20171127,Daniel_BogreUdell_20130101,11/27/2017,,,mji,,Kim Mun,Lanten,,Classification,Peru,,To Upload,CC BY-NC 3.0,,,,,,,1 checked out of 1,,,,,,1,,,No ID,"200,000 in China (Wang Fushi and Mao Zhongwu 1995). 61,000 in Hainan Province (2000 census). Population total all countries: 374,500.","Hmong-Mien, Mienic, Mian-Jin",,,,Eurasia,,2017-11-27,,
Barbara_20171127_nav,Barbara_TellerOrnelas_20171127,Daniel_BogreUdell_20130101,11/27/2017,,,nav,,Navajo,,,,Peru,3/22/2018,To Upload,CC BY-NC 3.0,,,,,,,1 checked out of 1,,,,,,1,,,No ID,"171,000 (2010 census). 7,600 monolinguals. Ethnic population: 266,000 (Ichihashi-Nakayama 2007).","Eyak-Athabaskan, Athabaskan, Apachean",,,,Americas,,2017-11-27,,
Lynda_20171127_nav,Lynda_TellerPete_20161127,Daniel_BogreUdell_20130101,11/27/2017,,,nav,,Navajo,,,,Peru,,To Upload,CC BY-NC 3.0,,,,,,,1 checked out of 1,,,,,,1,,,No ID,"171,000 (2010 census). 7,600 monolinguals. Ethnic population: 266,000 (Ichihashi-Nakayama 2007).","Eyak-Athabaskan, Athabaskan, Apachean",,,,Americas,,2017-11-27,,
Rangina_20171127_pst,Rangina_Hamidi_20161227,Daniel_BogreUdell_20130101,11/27/2017,,,pst,,"Pashto, Central",Pashto,,,Peru,3/20/2018,To Upload,CC BY-NC 3.0,,,,,,,1 checked out of 1,,,,,,1,,,No ID,"6,520,000 (2013 SIL).","Indo-European, Indo-Iranian, Iranian, Eastern, Southeastern, Pashto",,,,Eurasia,,2017-11-27,,
Wachwa_20171127_que,Wachwa_ParedesLlamocca_20171127,Daniel_BogreUdell_20130101,11/27/2017,,,que,,Quechua,Quechua Wari,,Classification,Peru,,To Upload,CC BY-NC 3.0,,,,,,,1 checked out of 1,,,,,,1,,,No ID,"Population total all languages: 8,912,820.",,,,,Americas,,2017-11-27,,
Wilbert_20171127_que,Wilbert_QuispeHuaman_20171127,Daniel_BogreUdell_20130101,11/27/2017,,,que,,Quechua,Quechua Chankas,,Classification,Peru,,To Upload,CC BY-NC 3.0,,,,,,,1 checked out of 1,,,,,,1,,,No ID,"Population total all languages: 8,912,820.",,,,,Americas,,2017-11-27,,
Luzmila_20171127_qvi,Luzmila_Zambrano_20171127,Daniel_BogreUdell_20130101,11/27/2017,,,qvi,,"Quichua, Imbabura Highland",Otavalo Kichwa,,,Peru,,To Upload,CC BY-NC 3.0,,,,,,,1 checked out of 1,,,,,,1,,,No ID,"150,000 (Gómez-Rendón 2007). Many monolinguals.","Quechuan, Peripheral Quechua, Chinchay, Northern Chinchay",,,,Americas,,2017-11-27,,
Luz_20171127_shp,Luz_FrancoAhuanari_20171127,Daniel_BogreUdell_20130101,11/27/2017,,,shp,,Shipibo-Conibo,Shipiba,,,Peru,,To Upload,CC BY-NC 3.0,,,,,,,1 checked out of 1,,,,,,1,,,No ID,"26,000 (2003 SIL).","Panoan, Mainline, Shipibo",,,,Americas,,2017-11-27,,
Modesto_20171127_spa,Modesto_NavaVega_20171127,Daniel_BogreUdell_20130101,11/27/2017,,,spa,,Spanish,,,,Peru,,To Upload,CC BY-NC 3.0,,,,,,Get a free Spanish lesson with italki: http://promos.italki.com/wikitongues_spa,1 checked out of 1,,,,,,1,,,No ID,"38,400,000 in Spain (ELDIA 2012). Population total all countries: 414,170,030. L2 users: 7,490,000 in Spain (ELDIA 2006).","Indo-European, Italic, Romance, Italo-Western, Western, Gallo-Iberian, Ibero-Romance, West Iberian, Castilian",,,,"Eurasia, Eurasia",,2017-11-27,,
Samuel_20171127_spa,Samuel_QuispeParedes_20161227,Daniel_BogreUdell_20130101,11/27/2017,,,spa,,Spanish,,,,Peru,,To Upload,CC BY-NC 3.0,,,,,,Get a free Spanish lesson with italki: http://promos.italki.com/wikitongues_spa,1 checked out of 1,,,,,,1,,,No ID,"38,400,000 in Spain (ELDIA 2012). Population total all countries: 414,170,030. L2 users: 7,490,000 in Spain (ELDIA 2006).","Indo-European, Italic, Romance, Italo-Western, Western, Gallo-Iberian, Ibero-Romance, West Iberian, Castilian",,,,"Eurasia, Eurasia",,2017-11-27,,
Arnulfo_20171127_nhn+spa,Arnulfo_Xochitiotzin_20171127,Daniel_BogreUdell_20130101,11/27/2017,,,"nhn,spa",,"Nahuatl, Central, Spanish",Central Nahuatl,,,Peru,,To Upload,CC BY-NC 3.0,,,,,,Get a free Spanish lesson with italki: http://promos.italki.com/wikitongues_spa,2 checked out of 2,,,,,,2,,,No ID,"40,000 (1980 census). All Nahuatl variety speakers: 1,380,000. 1,000 monolinguals (1990 census). Ethnic population: 63,000 (1986)., 38,400,000 in Spain (ELDIA 2012). Population total all countries: 414,170,030. L2 users: 7,490,000 in Spain (ELDIA 2006).","Uto-Aztecan, Southern Uto-Aztecan, Corachol-Aztecan, Core Nahua, Nahuatl, Indo-European, Italic, Romance, Italo-Western, Western, Gallo-Iberian, Ibero-Romance, West Iberian, Castilian",,,,"Americas, Eurasia, Eurasia",,2017-11-27,,
Zeferino_20171127_tqt,Zeferino_GaonaHernández_20171127,Daniel_BogreUdell_20130101,11/27/2017,,,tqt,,"Totonac, Ozumatlán",,,Classification,Peru,,To Upload,CC BY-NC 3.0,,,,,,,1 checked out of 1,,,,,,1,,,No ID,"1,610 (2000 census), decreasing.","Totonacan, Totonac",,,,Americas,,2017-11-27,,
Román_20171127_zap,Román_GutiérrezRuíz_20171127,Daniel_BogreUdell_20130101,11/27/2017,,,zap,,Zapotec,,,,Peru,3/21/2018,To Upload,CC BY-NC 3.0,,,,,,,1 checked out of 1,,,,,,1,,,No ID,"Population total all languages: 441,769.",,,,,Americas,,2017-11-27,,
Karl_20160802_spa,Karl_AndreiD.Flores_20160802,Karl_AndreiD.Flores_20160802,8/2/2016,,,spa,,Spanish,Philippines Spanish,,,Philippines,,To Upload,CC BY-NC 3.0,checked,,"¡Buenas! Soy Karl y soy de Filipinas. El español filipino es un dialecto del español hablado en las Filipinas y Micronesia. La mayoría de los filipinos de hoy no hablan español, como resultado de la colonización de los Estados Unidos. Se estima que sólo el tres por ciento de la población habla el idioma, pero aún así la mayoría de los hablantes hablan español europeo o español de México.

La fonología del español filipino es muy diferente a la de otros dialectos del español. Por ejemplo, tenemos la oclusiva glotal pronunciada entre dos vocales. Así, \&quot;país\&quot; es pronunciado \&quot;pa\&#039;is\&quot; y \&quot;Europa\&quot; fue pronunciada \&quot;E\&#039;uropa\&quot;. Se trata de una influencia de las lenguas austronesias de las Filipinas y Micronesia. Otra característica interesante es la palatalización de la ese cuando está al lado de una ye. Así, siempre es pronunciada. Igualmente el español filipino carece de aproximaciones y sólo hace uso de las oclusivas para las letras be, de y ge.

Una gran cantidad de filipinos me preguntan por qué hablo español hoy. Piensan que quiero ser español y que hablo el lenguaje utilizado para oprimir a nuestro pueblo, la lengua de los conquistadores. Pero creo que eso es falso. Se dice que (antes) la mayoría de los filipinos hablaban el idioma y uno no se podía mover alrededor de las islas si no hablaba Español. Incluso fue utilizado para la comunicación entre los diversos grupos étnicos del país. Creo que es un aspecto valioso de nuestro patrimonio que la mayoría de la gente parece haber olvidado. Claro, no solo era la lengua de los colonizadores, sino que también fue el idioma que unió a nuestros pueblos y nos dio una identidad nacional. Hoy en día, aunque aumenta el número de hablantes de español, es muy poco probable que alguna vez así llegue a la posición que tuvo hace un siglo.
","Greetings! I\&#039;m Karl and I\&#039;m from the Philippines. Philippine Spanish is a dialect of Spanish spoken in the Philippines and Micronesia. Most Filipinos today do not speak Spanish, a result of American colonization, and only an estimated 3% of the population does speak the language, but even then most speakers speak Castillian or Mexican Spanish.

The phonology of Philippine Spanish is quite different from other dialects of Spanish. For example, we have the glottal stop pronounced between two vowels. So país is pronounced pa\&#039;is and Europa is pronounced E\&#039;uropa. This is an influence from the Austroneian languages of the Philippines and Micronesia. Another interesting feature is the palatalization of the s when it\&#039;s next to a y. So siempre is pronounced shiempre. The dialect also has the e phoneme instead of the e one. Philippine Spanish also lacks approximants and only makes use of plosives for the letters be, de and ge.

A lot of Filipinos ask me today why I speak Spanish. They think I want to be a Spaniard and that I am speaking the language used to oppress our people, the language of the conquerors. But I think that is false. A majority of Filipinos were said to have spoken the language and you could not get around the islands once if you did not speak Spanish. It was even used for communication by the various ethnic groups in the country. I think its a valuable aspect of our heritage that most people seem to have forgotten. Sure, it was the language of the colonizers, but it was also the language that united our peoples and gave us a national identity. Today, while Spanish is currently rising in the number of speakers, it is highly unlikely that it well ever reach the position it once held a century ago.
","Lipa City, the Philippines",Get a free Spanish lesson with italki: http://promos.italki.com/wikitongues_spa,1 checked out of 1,,,,,,1,,,No ID,"38,400,000 in Spain (ELDIA 2012). Population total all countries: 414,170,030. L2 users: 7,490,000 in Spain (ELDIA 2006).","Indo-European, Italic, Romance, Italo-Western, Western, Gallo-Iberian, Ibero-Romance, West Iberian, Castilian",Indo-European,§Philippines Spanish,,"Eurasia, Eurasia",,2016-8-5,,
Karl_20160802_fil,Karl_AndreiD.Flores_20160802,Karl_AndreiD.Flores_20160802,8/2/2016,Screen Shot 2016-09-02 at 4.32.39 PM.png (https://dl.airtable.com/OqI2IxqkS0aP7hvn05ca_Screen%20Shot%202016-09-02%20at%204.32.39%20PM.png),Karl_s1_M_20160802_fil.jpg (https://dl.airtable.com/0hJ9Enl0SNy99RAWd3ff_Karl_s1_M_20160802_fil.jpg),fil,,Filipino,,,,Philippines,9/2/2016,Public,CC BY-NC 3.0,checked,,," My Tagalog is a mixture of several dialects, since my mother speaks Mindoreño Tagalog natively and my father speaks Batangueño Tagalog, coupled with the superstrate influences from Manileño Tagalog. I used the vocabulary I and most Filipinos would use in regular speech, so you\&#039;ll find a few English loanwords and phrases as is done in regular speech. Filipino is also used interchangeably with Tagalog, so I used both in this form.

","Lipa City, the Philippines",,1 checked out of 1,,,,,,1,,o9_h--Obpvw,https://youtu.be/o9_h--Obpvw,"L2 users: 45,000,000 (2013). Widely spoken as L2.","Austronesian, Malayo-Polynesian, Philippine, Greater Central Philippine, Central Philippine, Tagalog",Austronesian,§,,Eurasia,,2016-8-5,,
